,type,subtype,name,ingredients
0,Lunch,Bowl Recipes,Ramen Bowl,"['8 cups water', '8 cloves garlic, peeled and whole', '8 slices fresh ginger root', '1/2 medium onion, halved and separated', '4 eggs', '1 pinch salt and freshly ground black pepper to taste (optional)', '1/2 cup soy sauce', '1/4 cup sake', '2 tablespoons Thai-style chile sauce', '2 teaspoons sesame oil', '2 tablespoons white sugar', '1 1/2 teaspoons salt', '15 ounces dried Japanese-style noodles', '12 large shrimp, shelled and deveined, at room temperature', '4 large dry sea scallops, halved, at room temperature', '1 1/2 cups fresh bean sprouts', '1/2 cup sliced scallions']"
1,Lunch,Bowl Recipes,Do-It-Yourself Salmon Poke Bowls,"['4 cups cooked rice', '4 tablespoons soy sauce', '4 teaspoons rice vinegar', '4 teaspoons sesame oil', '1/4 teaspoon chile oil (optional)', '3/4 pound sashimi-grade salmon, cut into small cubes', '1 avocado, sliced, or to taste', '1 red bell pepper, sliced, or more to taste', '1/4 cup shelled edamame, or more to taste', '4 sheets dried seaweed, cut into strips, or to taste', '1 tablespoon pickled ginger, or to taste', '1 tablespoon furikake (Japanese nori seasoning), or to taste', '2 tablespoons chopped green onion, or to taste', '1 tablespoon sesame seeds, or to taste']"
2,Lunch,Bowl Recipes,Lemon Chicken and Snow Pea Noodle Bowls ,"['1 1/2 pounds boneless chicken breast', '2 teaspoons ground coriander', '1 (16 ounce) package angel hair pasta', '2 tablespoons extra-virgin olive oil', '2 cups chicken broth, divided', '2 cups snow peas, trimmed', '1 tablespoon lemon juice', 'salt and ground black pepper to taste', '1/2 cup chopped scallions']"
3,Lunch,Bowl Recipes,Gyudon Japanese Beef Bowl ,"['1 large white onion', '1 teaspoon vegetable oil', '1/2 cup water', '2 tablespoons soy sauce', '1 tablespoon brown sugar', '1 tablespoon mirin', '1 tablespoon sake', '1/2 pound beef ribeye steak, thinly sliced', '1 tablespoon sesame seeds, or to taste (optional)', '2 green onions, thinly sliced, or to taste (optional)', '2 teaspoons pickled ginger (beni shoga), or to taste (optional)', '1 sheet dried seaweed, cut into strips, or to taste (optional)']"
4,Lunch,Bowl Recipes,Vegan Quinoa and Guac Bowl,"['1 (15 ounce) can pinto beans, rinsed and drained', '2 1/2 cups water', '2 cups quinoa', '1/2 teaspoon kosher salt', '1 tablespoon olive oil', '1 red bell pepper, sliced', '1 yellow bell pepper, sliced', '1/2 teaspoon ground black pepper', '4 cups lettuce leaves', '1 cup vegan shredded cheese blend', '1 avocado - peeled, pitted, and sliced', '1/4 cup vegan sour cream']"
5,Lunch,Bowl Recipes,Asian Steak and Noodle Bowl,"['1/2 cup low-sodium soy sauce', '1/3 cup vegetable oil', '1/3 cup brown sugar', '1 tablespoon minced ginger', '1/2 teaspoon garlic powder', '2 pounds flank steak', '1 (10 ounce) package dried Japanese udon noodles', '6 ounces snow peas', '1 cup broccoli florets', '1 tablespoon mirin (Japanese sweet wine)']"
6,Lunch,Bowl Recipes,"Grain Bowl with Blackened Shrimp, Avocado, and Black Beans","['1 1/8 cups water', ""1/2 cup dirty rice mix (such as Zatarain's(R) Dirty Brown Rice)"", '1 pound large shrimp, peeled and deveined', '1 tablespoon chili powder', '2 teaspoons paprika', '1 1/2 teaspoons cumin', '1 teaspoon onion powder', '1 teaspoon salt', '1/4 teaspoon ground black pepper', '2 tablespoons olive oil', '1 (15 ounce) can corn, drained', '1 red bell pepper, diced', '1/4 cup chopped fresh cilantro', '1 lime, juiced', '1 tablespoon olive oil', '1 avocado', '1/4 cup chopped fresh cilantro', '1/4 cup plain Greek yogurt (such as Chobani(R))', '1 clove garlic', '3 tablespoons olive oil', '1/2 teaspoon salt', '1/4 teaspoon ground black pepper', '1 (15 ounce) can black beans, drained', '1 avocado, sliced', '1 lime, cut into wedges']"
7,Lunch,Bowl Recipes,Brown Rice Buddha Bowl,"['3 cups water', '1 cup long-grain brown rice', '1/2 teaspoon salt', '1 lime, juiced', '2 tablespoons olive oil', '1 tablespoon sesame oil', '1 tablespoon dried Thai basil', '1 teaspoon minced hot chile pepper', '2 tablespoons sesame seeds', '1/2 (8 ounce) package snow peas', '1 cup cooked chickpeas, drained', '1/2 (16 ounce) package firm tofu, cut into strips', '16 baby corn, cut into bite-sized pieces', '1 cup grated carrots', '1 small green bell pepper, diced', '2 green onions, cut on the diagonal', '2 tablespoons chopped fresh cilantro']"
8,Lunch,Bowl Recipes,Make-Ahead Sausage and Veggie Bowls,"['nonstick cooking spray', '3 tablespoons olive oil, divided', '1 1/4 cups uncooked brown rice', '2 1/2 cups water', '1/2 teaspoon salt', '5 Italian turkey sausage links', '1 large red onion, cut into 1-inch pieces', '1 pound Brussels sprouts, trimmed and halved', '1 teaspoon garlic powder', '1/2 teaspoon salt', '1/2 teaspoon ground black pepper', '1 orange bell pepper, cut into 1-inch pieces', '5 (3-cup) storage containers', '1/4 cup grated Parmesan cheese, or to taste']"
9,Lunch,Bowl Recipes,Vermicelli Noodle Bowl,"['1/4 cup white vinegar', '1/4 cup fish sauce', '2 tablespoons white sugar', '2 tablespoons lime juice', '1 clove garlic, minced', '1/4 teaspoon red pepper flakes', '1/2 teaspoon canola oil', '2 tablespoons chopped shallots', '2 skewers', '8 medium shrimp, with shells', '1 (8 ounce) package rice vermicelli noodles', '1 cup finely chopped lettuce', '1 cup bean sprouts', '1 English cucumber, cut into 2-inch matchsticks', '1/4 cup finely chopped pickled carrots', '1/4 cup finely chopped diakon radish', '3 tablespoons chopped cilantro', '3 tablespoons finely chopped Thai basil', '3 tablespoons chopped fresh mint', '1/4 cup crushed peanuts']"
10,Lunch,Bowl Recipes,Baja-Style Chicken Bowl,"['2 teaspoons olive oil', '4 ounces diced cooked chicken', '1/2 cup frozen corn', '1 red bell pepper, sliced', 'salt and ground black pepper to taste', '1 cup cooked brown rice', '1/2 cup salsa', '1/4 cup shredded Monterey Jack cheese']"
11,Lunch,Bowl Recipes,"Low-Carb ""Tacos""","['1 1/2 pounds ground beef', '1 onion, diced', '1/2 (4 ounce) can diced jalapeno peppers', '1 (1 ounce) package taco seasoning mix', '2 cups shredded lettuce', '1 tomato, chopped', '1/2 cup shredded reduced-fat Cheddar cheese', '1/4 cup salsa', '1/4 cup low-fat sour cream', '1 avocado - peeled, pitted, and sliced']"
12,Lunch,Bowl Recipes,Pad Thai Quinoa Bowl,"['4 cups low-sodium chicken broth', '2 cups quinoa, rinsed and drained', '1 tablespoon coconut oil, divided', '1 large boneless, skinless chicken breast, cut into thin strips', '3/4 cup shredded cabbage', '1/2 cup edamame', '1/4 cup diced broccoli stems', '2 carrots, cut into matchsticks', '2 green onions, chopped', '3 eggs', '1 teaspoon sesame oil', '1/4 cup natural peanut butter', '1/4 cup reduced-sodium soy sauce', '3 tablespoons rice vinegar', '2 tablespoons chili garlic sauce', '2 tablespoons chopped fresh ginger', '3 cloves garlic, minced', '1 teaspoon sesame oil', '1/2 cup salted peanuts, chopped', '3 tablespoons chopped fresh cilantro']"
13,Lunch,Bowl Recipes,Grilled Shrimp Rice Noodle Bowl,"['8 large fresh shrimp, peeled and deveined', '3 tablespoons olive oil', '3 cloves garlic', '1/2 cup fresh mint', '1/4 cup chopped fresh cilantro', '3 tablespoons fish sauce', '2 tablespoons honey', '1 lime, juiced', '1/4 teaspoon ground white pepper', '2 tablespoons fresh ginger root, minced', '3/4 cup shredded cabbage', '1 (6.75 ounce) package dried rice noodles']"
14,Lunch,Bowl Recipes,Buddha Bowl,"['3 cups chicken broth', '1 1/2 cups quinoa', '1 large sweet potato, diced', '1 large red onion, diced', '1/4 cup olive oil, divided', 'kosher salt to taste', 'freshly ground black pepper to taste', '3 cloves garlic, minced, divided', '1 tablespoon minced fresh ginger root', '1 pound skinless, boneless chicken breast halves', '1/4 cup lime juice', '2 tablespoons smooth peanut butter', '1 tablespoon soy sauce', '1 tablespoon honey', '1 tablespoon sesame oil', '2 cups baby spinach', '1 avocado - peeled, pitted, and thinly sliced', '1 tablespoon chopped fresh cilantro', '1 teaspoon toasted sesame seeds']"
15,Lunch,Bowl Recipes,Indonesian Pork Noodle Bowl,"['8 ounces vermicelli or angel hair pasta', '2 tablespoons olive oil, divided', '1 Smithfield(R) Garlic & Herb Seasoned Pork Loin Filet, cut into 1/4-inch thick strips', '1/2 teaspoon minced garlic', '1/2 teaspoon crushed red pepper flakes', '3 cups coarsely shredded cabbage', '2 cups chopped celery', '3 green onions, sliced', '1/3 cup soy sauce']"
16,Lunch,Bowl Recipes,Asian Shrimp Rice Bowl,"['1/3 cup soy sauce', '1/4 cup hoisin sauce', '2 tablespoons honey', '1 tablespoon chile paste', '2 tablespoons orange marmalade', '1/2 pound cooked shrimp', '2 cups uncooked jasmine rice', '3 cups water', '2 tablespoons olive oil', '1 orange bell pepper, cut into 1/2-inch dice', '1 red bell pepper, cut into 1/2-inch dice', '2 cups sugar snap peas', '1 sweet onion, cut into 1/2-inch dice', '4 cloves garlic, minced', '2 teaspoons minced fresh ginger root', '1/4 teaspoon sesame oil', '1 1/2 teaspoons sesame seeds']"
17,Lunch,Bowl Recipes,Lemon-Parmesan Chicken and Rice Bowl,"['1 cup rice', '5 tablespoons vegetable oil, divided', '2 cups hot water', '1 (8 ounce) package frozen broccoli', 'salt and ground black pepper to taste', '2 pounds skinless, boneless chicken breast, cut into 1-inch cubes', '1 1/2 teaspoons garlic powder', '1 1/2 teaspoons onion powder', '1 large onion, diced', '1 lemon, zested and juiced', '1/2 cup grated Parmesan cheese']"
18,Lunch,Bowl Recipes,Fried Chicken Bowl,"['vegetable oil for frying', '4 pieces frozen, breaded pre-cooked chicken strips', '2 cups prepared mashed potatoes', '6 ounces shredded Cheddar cheese', '1 (14 ounce) can whole kernel corn, drained']"
19,Lunch,Bowl Recipes,Ethiopian Vegetable Bowl,"['1/4 cup vegetable oil', '1/2 teaspoon ground ginger', '1/2 teaspoon ground turmeric', '1/2 teaspoon ground black pepper', '1 teaspoon ground cloves', '1 teaspoon fenugreek seeds', '1 head garlic, minced', '1 teaspoon salt', '3 large onions, chopped', '4 large carrots, cubed', '4 large potatoes, cubed', '1/4 head cabbage, chopped', '2 cups tomato puree', '2 cups water', 'salt and pepper to taste']"
20,Lunch,Bowl Recipes,Hiyashi Chuka Noodles,"['3 tablespoons soy sauce', '2 tablespoons white sugar', '3 tablespoons white vinegar', '5 tablespoons chicken stock', '1 teaspoon sesame oil', '1/2 teaspoon chili oil (optional)', '2 (3 ounce) packages ramen noodles', '1 egg, beaten', '1/2 cucumber, julienned', '1 carrot, grated', '1 slice cooked ham, cut into thin strips', '1/4 sheet nori, cut into thin slices', '1 tablespoon hot Chinese mustard (optional)']"
21,Lunch,Bowl Recipes,Quick Oyakodon,"['1 cup uncooked short-grain white rice', '2 cups water', '1 cup chicken stock', '1/4 cup soy sauce', '2 tablespoons brown sugar', '1/2 onion, thinly sliced', '1/2 cup shiitake mushrooms, thinly sliced', '1 skinless, boneless chicken breast half - cut into strips', '4 green onions, cut into 1-inch pieces', '2 eggs, beaten', '6 snow peas, thinly sliced']"
22,Lunch,Bowl Recipes,Spicy Chicken Noodles,"['1 large carrot, finely sliced or shredded', '2 cups shredded green cabbage', '1 red bell pepper, thinly sliced', '2 jalapeno pepper, seeded and minced', '1/2 cup chopped green onions', '3 cloves garlic, finely crushed', '1/2 cup chicken broth', '1/4 cup seasoned rice vinegar', '1 tablespoon hoisin sauce', '1 tablespoon soy sauce, plus more to taste', '1 tablespoon ketchup', '1 tablespoon brown sugar', '1 tablespoon sriracha hot sauce, or more to taste', '1 teaspoon red pepper flakes', '1 (8 ounce) package dried rice noodles', '1 pinch salt', '8 ounces cooked chicken breast, torn into bite-size pieces', '1 tablespoon sesame oil', '1 tablespoon vegetable oil', '1/2 cup freshly chopped cilantro']"
23,Lunch,Bowl Recipes,Orange-Chicken Rice Bowl,"['2 tablespoons Asian-style toasted sesame salad dressing', '1 pound skinless, boneless chicken breast halves - cut into 1 1/2 inch pieces', '1/4 cup orange juice', '2 tablespoons Asian-style toasted sesame salad dressing', '1 red bell pepper, cut into 1 inch chunks', '1 zucchini, cut into 1 inch chunks', '2 cups broccoli florets', '2 green onions, cut into 1/2-inch pieces']"
24,Lunch,Bowl Recipes,Asian Noodle Bowl,"['1 pound bison skirt steak or bison ribeye steak', '2 tablespoons soy sauce', '1 (14.5 ounce) can beef broth', '2 cups water', '6 ounces vermicelli rice noodles or angel hair pasta', '3/4 cup purchased peanut sauce', '2 cups bite-size broccoli florets', '2 medium carrots, cut into thin bite-size strips', '1/4 cup chopped peanuts', '2 sliced green onions', '2 tablespoons chopped fresh cilantro (optional)', 'Asian chili sauce (Sriracha sauce) (optional)', 'Soy sauce (optional)']"
25,Lunch,Bowl Recipes,Sausage Egg Roll in Bowl,"['1 pound ground pork sausage', '6 cups coleslaw mix', '2 carrots, peeled and grated', '1/4 cup chopped green onions', '4 cloves garlic, minced', '1 tablespoon low-sodium soy sauce', '1 tablespoon sesame oil', '2 tablespoons shelled sunflower seeds (optional)', '1 tablespoon grated ginger root']"
26,Lunch,Bowl Recipes,T's Smoky Noodle Bowl,"['4 cups chicken broth', '1 (14 ounce) can coconut milk', '2 ears corn, kernels cut for the cob', '1/4 cup soy sauce', '2 tablespoons fried garlic chile oil', '1 tablespoon smoked paprika', '1 tablespoon sriracha hot sauce', '1 tablespoon honey', '4 cloves garlic, grated', '1 cube chicken bouillon', '1 teaspoon red pepper flakes', '1 teaspoon cracked black pepper', '1/2 teaspoon seasoned salt', '3 ounces fresh udon noodles, or more to taste', '1 pound shrimp']"
27,Lunch,Bowl Recipes,Curried Quinoa Veggie Bowl,"['2 tablespoons coconut oil, melted', '1 tablespoon garam masala or curry powder', '1 teaspoon ground cumin', '1/2 teaspoon salt', '1 large head cauliflower, separated into florets', '1 tablespoon coconut oil', '1 clove garlic', '1/2 cup chopped onion', '1 cup quinoa', '2 cups Silk(R) Unsweetened Coconutmilk', '1 1/2 teaspoons curry powder', '1/2 teaspoon salt', '1 cup fresh or frozen peas', 'Toasted coconut flakes, for garnish']"
28,Lunch,Bowl Recipes,Easy Keto Korean Beef with Cauli Rice,"['2 teaspoons sesame oil', '1 pound lean ground beef', '3 cloves garlic, minced', '1/4 cup soy sauce', '1 tablespoon coconut sugar', '1/4 teaspoon ground ginger', '1/4 teaspoon ground black pepper', '2 cups cauliflower rice', '2 tablespoons chopped green onions', '1 tablespoon sesame seeds']"
29,Lunch,Bowl Recipes,Easy Korean Ground Beef Bowl,"['1 pound lean ground beef', '5 cloves garlic, crushed', '1 tablespoon freshly grated ginger', '2 teaspoons toasted sesame oil', '1/2 cup reduced-sodium soy sauce', '1/3 cup light brown sugar', '1/4 teaspoon crushed red pepper', '6 green onions, chopped, divided', '4 cups hot cooked brown rice', '1 tablespoon toasted sesame seeds']"
30,Lunch,Bowl Recipes,Skillet Burrito Bowl,"['1 tablespoon vegetable oil', '1 pound ground beef', '1 tablespoon fajita seasoning', '1 (15 ounce) can pinto beans, drained and rinsed', '1 (8 ounce) jar salsa', '1 cup cooked brown rice', '1/2 cup shredded Mexican cheese blend']"
31,Lunch,Bowl Recipes,The West Seattle Sweet Potato and Kale Bowl,"['1 1/4 cups water', '1 pinch salt', '1/4 cup pearl barley', '3 sweet potatoes, peeled and cubed', '2 tablespoons olive oil', '1/4 teaspoon Cajun seasoning', '2 (15.25 ounce) cans black beans, rinsed and drained', '1/4 cup coconut milk', '1 tablespoon canola oil', '1 bunch kale, stems removed and discarded, leaves torn into bite-size pieces']"
32,Lunch,Bowl Recipes,Spicy Tofu Salad Bowl,"['3 green onions, chopped', '2 tablespoons soy sauce', '2 tablespoons toasted sesame seeds', '1 1/2 teaspoons Korean chile pepper powder, or to taste', '1 teaspoon white sugar', '1/2 teaspoon toasted Asian sesame oil', '1 1/2 cups steamed Japanese rice', '1/2 head of romaine lettuce (heart only), torn into bite-size pieces', '1/2 cucumber - peeled, seeded, and chopped', '1 (12 ounce) package tofu, sliced']"
33,Lunch,Bowl Recipes,"Spicy Tahini Sauce with Kale, Sea Vegetables, and Soba Noodles","['3/4 cup tahini', '3 tablespoons rice vinegar', '2 tablespoons soy sauce', '2 tablespoons olive oil', '1/2 teaspoon chile-garlic sauce (such as Sriracha(R))', '1/2 teaspoon ground turmeric', '2 tablespoons water, or more as needed', '1 (1.76 ounce) packet arame seaweed', '1 (8 ounce) package dried soba noodles', '1 tablespoon olive oil', '2 cloves garlic, minced', '2 tablespoons minced fresh ginger, or to taste', '1 bunch kale, torn into bite-sized pieces']"
34,Lunch,Bowl Recipes,Thai Curry Noodle Bowl,"['1 tablespoon peanut oil', '2 cloves garlic, minced', '1 (32 ounce) carton Swanson(R) Thai Ginger Flavor Infused Broth', '1 large carrot, peeled and cut into 2-inch matchstick thin strips', '1 (8 ounce) package wide rice noodles, prepared according to package directions', '3 tablespoons sliced green onions', '1/3 cup chopped fresh cilantro leaves', '3 tablespoons chopped dry-roasted, salted peanuts', '6 wedges lime']"
35,Lunch,Bowl Recipes,Carrie's Pad Thai Salad,"['1 (12 ounce) package dried rice noodles', '1/2 cup white sugar', '1/4 cup water', '1/2 lime, juiced', '2 tablespoons soy sauce', '2 tablespoons fish sauce', '1 teaspoon tamarind concentrate', '1/4 cup peanut oil', '1 clove garlic, minced', '4 eggs', '1 tablespoon paprika', '1/4 teaspoon chili powder, or to taste (optional)', '1 head lettuce, chopped, or as needed', '2 tablespoons flaxseed oil', '1/2 cup fresh bean sprouts, or to taste (optional)', '1/2 cup chopped green onion', '1/2 cup chopped fresh cilantro', '1/2 cup chopped peanuts', '1/2 lime, cut into wedges']"
36,Lunch,Bowl Recipes,Naked Chicken Burrito Bowl ,"['2 skinless, boneless chicken breasts', '1/2 teaspoon garlic powder, or to taste', 'salt and ground black pepper to taste', '1 (15.25 ounce) can white corn kernels, drained', '1 (15 ounce) can black beans, drained', '1 1/2 cups cooked long-grain white rice', '1/2 cup shredded Monterey Jack cheese', '3/4 cup chopped lettuce', '1/3 (8 ounce) jar salsa', '1/2 cup sour cream']"
37,Lunch,Bowl Recipes,Quinoa Bowl,"['1 tablespoon extra-virgin olive oil, or as needed', '3 sweet potatoes, cut into 1/2-inch pieces, or more to taste', 'salt to taste', '1 large yellow onion, chopped', '1 clove garlic, chopped', '1 cup asparagus, or more to taste', '4 cups water', '2 cups quinoa', '1 cup cashews']"
38,Lunch,Bowl Recipes,Healthy Big Bowl,"['7 red potatoes, scrubbed and quartered', 'salt', '1/2 cup milk', '2 tablespoons butter', '2 cloves garlic, minced', '2 tablespoons olive oil', '2 links smoked beef sausage (such as Eckrich(R)), sliced into 1-inch pieces', '1 bunch asparagus, stemmed and chopped', '2 cups frozen sweet white corn', '2 cups chopped broccoli florets', '3 cups beef broth', '3 tablespoons all-purpose flour, or more as needed', 'ground black pepper']"
39,Lunch,Bowl Recipes,Kristy's Le Tofu Orange,"['1 (14 ounce) package baked firm tofu, cut into 1-inch cubes', '2 tablespoons olive oil, or as needed, divided', ""12 ounces riced cauliflower (such as Trader Joe's(R))"", '2 onions, chopped', '3 scallions, chopped', '2 cloves garlic, minced', '2 green bell peppers, chopped', '2 tablespoons water', '1 tablespoon orange liqueur (such as Grand Marnier(R))', '1 tablespoon soy sauce', '2 red chile peppers, shredded', '1 pinch salt']"
40,Lunch,Bowl Recipes,Thai Coconut Chicken Soup (Noodle Bowl),"['1 (8 ounce) package dried Thai rice noodles', '6 cups chicken broth', '2 stalks lemongrass', '1 boneless, skinless chicken breast', '1 cup sliced cremini mushrooms', '1 fresh red chile pepper, minced, or more to taste', '1 (14 ounce) can coconut milk', '2 tablespoons grated ginger', '2 tablespoons fish sauce (optional)', '1 tablespoon minced garlic', '2 tablespoons lime juice', '1 pinch white sugar, or to taste (optional)', '1 lime, cut into wedges', '3 green onions, sliced', '1 small bunch fresh basil leaves, chopped']"
41,Lunch,Bowl Recipes,Asian Steak and Noodle Bowl,"['1/2 cup low-sodium soy sauce', '1/3 cup vegetable oil', '1/3 cup brown sugar', '1 tablespoon minced ginger', '1/2 teaspoon garlic powder', '2 pounds flank steak', '1 (10 ounce) package dried Japanese udon noodles', '6 ounces snow peas', '1 cup broccoli florets', '1 tablespoon mirin (Japanese sweet wine)']"
42,Lunch,Bowl Recipes,Crunchy Lemon Quinoa and Asparagus Bowl,"['1 pound fresh asparagus, trimmed', '2 teaspoons coconut oil', '1/2 onion, diced', '2 cloves garlic, minced', '1 cup cooked red quinoa', '1/2 cup low-sodium vegetable stock', '1 tablespoon ground turmeric', '1/2 cup nutritional yeast', '1/2 large lemon, juiced']"
43,Lunch,Bowl Recipes,North African Beef and Brown Rice,"['1/2 pound beef round steak, diced', '1/2 small onion, finely diced', '1 tablespoon tomato-chicken bouillon granules (such as Knorr(R))', '3 cloves garlic, minced', '1 cup water', '1 tablespoon beef stock concentrate', '1/3 pound carrots, cut into 1/2-inch dice', '3/4 pound sweet potatoes, cut into 1/2-inch dice', '1 1/2 cups water', '3/4 cup finely shredded cabbage', '2 cinnamon sticks', '1 1/2 teaspoons smoked paprika', '1/2 teaspoon ground cumin', '1/2 teaspoon ground black pepper', '1/2 teaspoon ground coriander', '5 black cardamom seeds', '1 cup brown rice']"
44,Lunch,Bowl Recipes,Broccoli Cauliflower Chickpea Bowl,"['1/2 cup cashews', '4 cups broccoli florets', '4 cups cauliflower florets', '1/2 teaspoon garlic powder', 'salt and ground black pepper to taste', '1 (15 ounce) can chickpeas (garbanzo beans), drained and rinsed', '2 tablespoons lemon juice', '1 tablespoon tahini', '1/2 teaspoon salt']"
45,Lunch,Bowl Recipes,One-Skillet Chicken Burrito Bowls,"['3 tablespoons olive oil, divided', '1/4 cup diced onion', '1 pound boneless, skinless chicken breasts, cut into bite-size pieces', '1 (5.4 ounce) package Knorr(R) Fiesta Sides(TM) - Mexican Rice', '1 (15 ounce) can reduced-sodium black beans, rinsed and drained', '1 cup shredded Monterey Jack cheese', '1/2 cup pico de gallo']"
46,Lunch,Bowl Recipes,Shortcut Beef Noodle Bowl,"['1 (16 ounce) package linguine pasta', '3 cups broccoli florets', '3 carrots, peeled and sliced', '2 teaspoons vegetable oil', '1 pound beef sirloin steak, cut into strips', '1 1/2 cups Asian toasted sesame dressing (such as Kraft(R))', '1/4 cup teriyaki sauce']"
47,Lunch,Bowl Recipes,Sweet Thai-Style Chicken Bowl,"['3 cups water', '1 1/2 cups jasmine rice', '1 teaspoon salt', '3 skinless, boneless chicken breast halves', '1/2 cup soy sauce', '1 tablespoon water, or as desired', '1 (14 ounce) can coconut milk', '1 cup white sugar', '2 tablespoons curry powder', '1 mango - peeled, seeded, and diced', '2 cups clover sprouts, or to taste', '1 cup finely chopped cashews', '1 bunch fresh cilantro, finely chopped', '4 green onions, chopped']"
48,Lunch,Bowl Recipes,Japanese-Style Crispy Fried Pork Bowl (Tonkatsu Donburi),"['2/3 cup prepared dashi stock', '2 teaspoons white sugar', '2 teaspoons mirin (Japanese sweet wine)', '2 teaspoons soy sauce', '1/2 teaspoon salt', '1 tablespoon vegetable oil', '1 small onion, chopped', '2 (3 ounce) fried breaded pork chops, sliced into long strips', '2 eggs, beaten', '1 1/2 cups cooked short-grain rice']"
49,Lunch,Bowl Recipes,Gyudon Japanese Beef Bowl ,"['1 large white onion', '1 teaspoon vegetable oil', '1/2 cup water', '2 tablespoons soy sauce', '1 tablespoon brown sugar', '1 tablespoon mirin', '1 tablespoon sake', '1/2 pound beef ribeye steak, thinly sliced', '1 tablespoon sesame seeds, or to taste (optional)', '2 green onions, thinly sliced, or to taste (optional)', '2 teaspoons pickled ginger (beni shoga), or to taste (optional)', '1 sheet dried seaweed, cut into strips, or to taste (optional)']"
50,Lunch,Bowl Recipes,Sweet and Savory Ramen Noodles,"['2 cups water', '1 (3 ounce) package ramen noodles (such as Maruchan(R) Instant Lunch), seasoning packet discarded', '1/4 cup maple syrup', '1 teaspoon ground cumin', '1 teaspoon garlic powder', '1 teaspoon Italian seasoning', '1 teaspoon ground paprika']"
51,Lunch,Bowl Recipes,Brown Rice Buddha Bowl,"['3 cups water', '1 cup long-grain brown rice', '1/2 teaspoon salt', '1 lime, juiced', '2 tablespoons olive oil', '1 tablespoon sesame oil', '1 tablespoon dried Thai basil', '1 teaspoon minced hot chile pepper', '2 tablespoons sesame seeds', '1/2 (8 ounce) package snow peas', '1 cup cooked chickpeas, drained', '1/2 (16 ounce) package firm tofu, cut into strips', '16 baby corn, cut into bite-sized pieces', '1 cup grated carrots', '1 small green bell pepper, diced', '2 green onions, cut on the diagonal', '2 tablespoons chopped fresh cilantro']"
52,Lunch,Bowl Recipes,Khitchari,"['4 cups water', '1/2 cup basmati rice', '1/2 cup split mung beans', '1 teaspoon grated fresh ginger, or more to taste', '1 teaspoon ground coriander', '1 teaspoon dried oregano leaves', '1 clove garlic, minced', '1/2 teaspoon ground cumin', '1/4 teaspoon fennel seeds']"
53,Lunch,Bowl Recipes,Superfast Asian Noodle Bowl for 1,"['2 cups water', '1/2 jalapeno pepper, very thinly sliced', '1 (3 ounce) package chicken-flavored ramen noodles', '2 mushrooms, thinly sliced', '3 wedges lime, juiced', '1 green onion, sliced', '1 tablespoon cilantro leaves', '1/4 teaspoon garlic chile paste', '1/8 teaspoon sesame oil']"
54,Lunch,Bowl Recipes,Weeknight Noodle Bowl,"['1 pound spaghetti', '4 cups water', '1/2 pound cooked chicken breast, chopped', '1 (1 ounce) package onion soup mix', '1 tablespoon chile-garlic sauce', '3 cloves garlic, minced', '1/4 teaspoon ground ginger', '3 cups broccoli florets']"
