,type,subtype,name,ingredients
55,Lunch,Bowl Recipes,"Coconut Lime Rice Bowl with Roasted Corn, Jalapenos, and Chicken","['1 teaspoon coconut oil', ""1 1/2 cups UNCLE BEN'S(R) Basmati Rice - cooks in 10 minutes"", '2 (13.5 ounce) cans light coconut milk', '2 limes, zested and juiced', 'salt to taste', '4 corn or flour tortillas', 'nonstick cooking spray', '2 jalapeno chile peppers', '1 (15.25 ounce) can whole kernel corn, well drained', '1 tablespoon canola oil, divided', '8 ounces skinless, boneless chicken breasts, cut into bite-size pieces', '2 tablespoons chili powder', '1 tablespoon ground cumin', '1 cup canned black beans, drained', '1 cup chopped fresh tomatoes', '1 avocado - peeled, pitted and diced (optional)', '4 tablespoons sour cream']"
56,Lunch,Bowl Recipes,Dogs 'n' Beans Rice Bowl,"['4 beef or turkey hot dogs, sliced into 1-inch pieces', ""1 (16 ounce) can baked beans (such as Bush's Original(R))"", ""2 (8.8 ounce) packages UNCLE BEN'S(R) Ready Rice - Whole Grain Brown"", '1 cup frozen green petite peas, thawed', '1/2 cup shredded Cheddar cheese, plus more for topping if desired']"
57,Lunch,Bowl Recipes,Turkey and Spinach Rice Bowl,"['2 cups cooked turkey, diced', '4 1/2 teaspoons soy sauce, divided', ""1 1/2 cups UNCLE BEN'S(R) ORIGINAL CONVERTED(R) Brand Rice"", '1/2 teaspoon salt, divided', '3 cups chicken broth, divided', '1 cup water', '4 cups baby spinach, torn into bite-size pieces', '1 bunch green onions, chopped', '1 tablespoon toasted sesame oil', '1 tablespoon toasted sesame seeds (optional)']"
58,Lunch,Bowl Recipes,Cao Lau (Vietnamese Noodle Bowl),"['2 tablespoons soy sauce', '4 cloves garlic, minced, or more to taste', '2 teaspoons Chinese five-spice powder', '2 teaspoons white sugar', '1 teaspoon paprika', '1/4 teaspoon chicken bouillon granules', '1 1/2 pounds pork tenderloin, cut into cubes', '2 tablespoons vegetable oil', '2 tablespoons water', '2 pounds fresh thick Vietnamese-style rice noodles', '2 cups bean sprouts', '1 cup torn lettuce leaves', '1 bunch green onions, chopped', '1/4 cup fresh basil leaves', '1/4 cup fresh cilantro leaves', '1/4 cup crispy chow mein noodles, or more to taste']"
59,Lunch,Bowl Recipes,Sesame Kale Glow Bowl,"['2 cups water', '1 cup quinoa', '1 tablespoon coconut oil', '1/2 red onion, chopped', '3 cups torn kale leaves', '2 cups broccoli florets', '4 ounces tempeh, crumbled', '1 clove garlic, minced', '2 tablespoons sesame seeds', '2 tablespoons water', '2 tablespoons tamari', '1 lime, juiced', '1 1/2 teaspoons Dijon mustard', '1 teaspoon minced fresh ginger', '1/2 teaspoon ground black pepper', '1 pinch red pepper flakes (optional)']"
60,Lunch,Bowl Recipes,Mexican Vegetable Rice Bowl,"['4 teaspoons liquid amino acid (such as Bragg(R)), divided', '1/4 teaspoon onion powder', '1 large zucchini, diced small', '2 large kale leaves, cut into 1-inch squares', '1/2 (14 ounce) can coconut milk', '1/2 cup raw macadamia nuts', '1/4 cup raw cashews', '1/4 cup nutritional yeast', '2 teaspoons chili powder', '1 pinch cayenne pepper, or to taste', '1 pinch red pepper flakes, or to taste', '1 teaspoon vegetable oil', '1 cup hot cooked brown rice']"
61,Lunch,Bowl Recipes,Vegan Quinoa and Guac Bowl,"['1 (15 ounce) can pinto beans, rinsed and drained', '2 1/2 cups water', '2 cups quinoa', '1/2 teaspoon kosher salt', '1 tablespoon olive oil', '1 red bell pepper, sliced', '1 yellow bell pepper, sliced', '1/2 teaspoon ground black pepper', '4 cups lettuce leaves', '1 cup vegan shredded cheese blend', '1 avocado - peeled, pitted, and sliced', '1/4 cup vegan sour cream']"
62,Lunch,Bowl Recipes,Beef and Broccoli Noodle Bowl,"['1 (8 ounce) package penne pasta', '3 cups broccoli florets', '12 ounces boneless beef chuck, partially frozen', '1 tablespoon olive oil', '1 onion, cut into 1/2-inch slices', '2 cloves garlic, minced', '1 tablespoon all-purpose flour', '1/4 teaspoon salt', '1/4 teaspoon ground black pepper', '1 (14 ounce) can beef broth', '1/4 cup tomato paste', '1 teaspoon Dijon mustard']"
63,Lunch,Bowl Recipes,Noodle Bowls,"['1 (8 ounce) package dried cellophane (glass) noodles', '1 cup peanuts', '1 head heart of romaine lettuce, shredded', '1 cucumber, cut into matchsticks', '2 carrots, cut into matchsticks', '1 cup mung bean sprouts', '1 cup cilantro leaves, chopped', '1 cup fresh mint leaves, slivered', '1/2 cup chopped green onions', '1/2 cup soy sauce, or to taste', '1 teaspoon wasabi paste, or to taste']"
64,Lunch,Bowl Recipes,Korean Barbecue Rice Bowl,"['1 (15 ounce) package beef roast in au jus', ""1 (8.5 ounce) package UNCLE BEN'S(R) Jasmine READY RICE(R)"", '1 tablespoon vegetable oil, divided', '1 (8 ounce) package button mushrooms, quartered', '1 teaspoon Korean barbecue sauce', '4 cups baby spinach', '1 clove garlic, finely chopped', '2 cups shredded carrots', '1 teaspoon chopped fresh ginger root', '2 tablespoons Korean barbecue sauce, or to taste']"
65,Lunch,Bowl Recipes,Vegan Korean Kimchi Fried Rice,"['1 tablespoon vegetable oil', '1/4 cup diced red onion', '1 tablespoon minced garlic', '1 1/2 teaspoons minced ginger (optional)', '1/2 cup finely chopped kimchi', '1 tablespoon rice wine vinegar', '1 cup day-old cooked white rice', '2 tablespoons white sugar', '2 tablespoons reduced-sodium soy sauce', '2 tablespoons kimchi brine', '1/2 tablespoon sesame oil', 'salt to taste', 'ground black pepper to taste']"
66,Lunch,Bowl Recipes,Cilantro-Lime Quinoa Bowl with Blackened Tilapia,"['1 1/2 tablespoons paprika', '1/2 tablespoon onion powder', '1/2 teaspoon salt', '1/2 teaspoon ground black pepper', '1/2 teaspoon cayenne pepper', '1/2 teaspoon dried oregano', '1/4 teaspoon garlic powder', '2 tilapia fillets', '1 cup water', '1/2 cup quinoa', '1/8 teaspoon salt', '1 large lime, zested and juiced', '1/2 cup chopped fresh cilantro', 'salt to taste', '1 tablespoon vegetable oil', '2 cups chopped romaine lettuce, or to taste', '1 cup fresh spinach leaves, or to taste', '1 (15 ounce) can black beans, rinsed and drained', '1 Roma tomato, chopped', '1 avocado, chopped', '2 tablespoons roasted pepitas, or to taste', '2 wedges lime']"
67,Lunch,Bowl Recipes,Teriyaki Chicken Bowl,"['8 ounces Dietz & Watson Teriyaki Chicken', '3/4 cup Bibb lettuce', '1/2 cup cooked brown rice', '1/2 cup soybeans', '1/4 chopped scallions', '1/4 cup sliced shiitake mushrooms', '1/2 cup cucumber ribbons', '1 sliced avocado', '2 tablespoons teriyaki glaze', '1/4 teaspoon poppy seeds']"
68,Lunch,Bowl Recipes,Asian-Inspired Vegetable Noodle Bowl ,"['1 (8 ounce) package egg noodles', '3 1/2 cups vegetable stock', '2 tablespoons soy sauce', '1 tablespoon chopped fresh ginger', '1 teaspoon Asian chile sauce', '1 garlic clove, chopped', '5 1/2 ounces frozen spinach, thawed', '1 1/2 cups frozen green soybeans, thawed', '1 red bell pepper, sliced']"
69,Lunch,Bowl Recipes,Roasted Veggie Buddha Bowl,"['1 cup water', '1/2 cup bulgur', '1 sweet potato, peeled and cut into 1-inch cubes', '4 teaspoons olive oil, divided', 'salt and ground black pepper to taste', '1/2 pound fennel bulb, trimmed and cut into 1-inch cubes', '1 small red onion, cut into 1-inch pieces', '1 red bell pepper, cut into 1-inch strips', '1 (8 ounce) package tempeh, cut into 1-inch pieces', '1/2 teaspoon curry powder', '2 teaspoons coconut oil', '1/4 cup fresh squeezed orange juice', '2 tablespoons olive oil', '2 teaspoons red wine vinegar', '1/2 teaspoon curry powder', '1/4 teaspoon salt', '1/4 teaspoon ground black pepper', '2 tablespoons raw pumpkin seeds (pepitas)']"
70,Lunch,Bowl Recipes,Deconstructed California Roll Bowl ,"['2 skinless, boneless chicken breasts', '1 cup teriyaki marinade', '1 tablespoon orange juice concentrate', '2 cups water', '1 cup uncooked short-grain white rice', '1 tablespoon peanut oil', '1 onion, cut into strips', '1 zucchini, cut into strips', '1 tablespoon soy sauce, or to taste', '1 tablespoon black sesame seeds', '1 avocado, chopped', '1 teaspoon wasabi paste, or to taste']"
71,Lunch,Bowl Recipes,California/Mexican Cauliflower Rice with Avocado and Kale,"['1 head cauliflower, broken into florets', '1 (15 ounce) can black beans, drained and rinsed', '1 small bunch fresh cilantro, finely chopped', '2 green onions, chopped, or more to taste', '1 tablespoon vegetable oil', '1/2 lime, juiced', '1 pinch salt and ground black pepper to taste', '2 slices Cheddar cheese', '1 (7 ounce) can chipotle peppers in adobo sauce', '1 tablespoon vegetable oil', '1 zucchini, halved and sliced', '4 leaves Tuscan kale, stemmed and chopped', '2 eggs', '1 avocado, sliced']"
72,Lunch,Bowl Recipes,Craving-Vietnamese Salad,"['1/4 cup mirin (Japanese sweet wine)', '3 tablespoons soy sauce', '3 tablespoons fish sauce', '1 tablespoon sriracha sauce, or more to taste', '1 tablespoon brown sugar', '1 tablespoon minced garlic', '1 pound thin-cut boneless pork chops, sliced very thinly', '1 tablespoon vegetable oil', '1 (8 ounce) package rice vermicelli noodles', '1 pound cooked and peeled shrimp', '1 bunch scallions, thinly sliced', '1 head red leaf lettuce, coarsely shredded', '1 1/2 cups matchstick-cut carrots', '1 cucumber - peeled, seeded, and cut into 1-inch matchsticks', '1/2 red bell pepper, cut into 1-inch matchsticks', '1 bunch cilantro, stems discarded', '1/2 cup bottled Asian sesame dressing', '1/3 cup mirin (Japanese sweet wine)', '1/4 cup fish sauce', '1 tablespoon sriracha sauce, or more to taste', '3/4 cup salted peanuts']"
73,Lunch,Bowl Recipes,"Sorghum, Quail Egg, Avocado, Kumato®and Buffalo Mozzarella Bowl","['3 cups water', '1 cup sorghum grain', '5 quail eggs', '1/2 teaspoon Sriracha salt, or to taste', '1/4 teaspoon ground cumin', '2 tablespoons avocado oil, divided', '1/2 teaspoon vinegar', '4 ounces fresh buffalo mozzarella', '4 fresh basil leaves', '1 avocado, sliced', '1 Kumato(R) tomato, diced', '4 radishes, sliced']"
74,Lunch,Bowl Recipes,Chickpea Buddha Bowl,"['1 cup vegetable broth', '1/2 cup red quinoa', '1 3/4 cups Brussels sprouts', '1/4 cup cubed carrots', '1/4 cup peeled and cubed parsnips', '1/2 red onion, chopped', '2 teaspoons olive oil, divided', '1 (15 ounce) can chickpeas, drained and patted dry', '1 teaspoon ground turmeric', '1/4 cup tahini', '2 tablespoons lemon juice', '1 tablespoon maple syrup', '5 tablespoons hot water', '1 avocado, mashed']"
75,Lunch,Bowl Recipes,Spicy Salmon and Vegetable Bowl,"['2 tablespoons chili garlic sauce (sambal)', '3 tablespoons soy sauce', '2 tablespoons sesame oil', '1 1/2 tablespoons brown sugar', '1 tablespoon rice wine vinegar', '4 (6 ounce) salmon fillets, cut into 1-inch squares', '1 red bell pepper, seeded and cut into 1-inch squares', '1 cup snow peas', '4 carrots, peeled and thinly sliced', '4 cups cooked jasmine rice', 'Reynolds Wrap(R) Non Stick Aluminum Foil']"
76,Lunch,Bowl Recipes,Tonkatsu Shoyu Ramen (Pork Cutlet Soy Sauce Ramen),"['1 egg', '1 1/2 teaspoons spicy sesame oil', '2 (1x3-inch) boneless pork chop slices', '2 tablespoons olive oil, divided', '1 tablespoon black sesame seeds, divided', '2 leaves fresh basil, chopped, divided', '1 leaf fresh sage, chopped, divided', '1 (3 ounce) package instant ramen noodles (such as Shirakiku(R)), seasoning packet discarded', '3 tablespoons shredded dried kombu', '1 3/4 tablespoons bonito soup stock (such as Hondashi(R))', '1 3/4 tablespoons soy sauce (shoyu)', '1/2 teaspoon white miso paste with dashi', '4 1/3-inch slices fish paste stick (naruto)', '1 tablespoon tonkatsu sauce', '1 tablespoon sushi ginger (shoga), finely chopped', '1 green onion, thinly sliced', '1 pinch ground black pepper']"
77,Lunch,Bowl Recipes,Healthy Tasty Salmon Rice Bowl,"['1/2 pound salmon, cut into chunks', '1/2 cup thinly sliced kale, or to taste', '2 green onions, chopped', '1 (1/2 inch) piece fresh ginger, thinly sliced, or to taste', '1 tablespoon water, or more if needed', 'salt and ground black pepper to taste', '1 cup cooked rice, or to taste', '1 sheet seaweed, torn into small pieces', '1/2 teaspoon toasted sesame oil, or to taste (optional)']"
78,Lunch,Bowl Recipes,Ginger Noodle Bowl: The Vegan Version,"['2 tablespoons coconut oil', '2 1/2 pounds bok choy, cut into bite-sized pieces', '6 cloves garlic, grated', '1 (3 inch) piece fresh ginger, grated', '3 cups shredded carrots', '2 teaspoons Chinese five-spice powder', '1 teaspoon ground cumin', '12 cups vegetable broth', '2 (2 ounce) packages cellophane noodles', '3 cups fresh bean sprouts', '5 scallions, trimmed and thinly sliced']"
79,Lunch,Bowl Recipes,Teriyaki Beef & Bean Rice Bowls from Del Monte®,"['2 1/2 pounds lean stew beef, cut into 1 1/2-inch cubes', '1 (14.5 ounce) can Del Monte(R) Original Recipe Stewed Tomatoes, not drained', '1 (15 ounce) can kidney beans, rinsed and drained', '1 (1.3 ounce) package pot roast seasoning mix for slow cookers', '1 cup water', '1/2 cup reduced-sodium teriyaki sauce, or more as needed', '1 (14.5 ounce) can DEL MONTE(R) Cut Green Beans, drained', '2 (8.8 ounce) packages heat-and-serve white rice', 'Reduced-sodium soy sauce', 'Sliced green onions', 'Toasted sesame seeds', 'Grated orange zest']"
80,Lunch,Bowl Recipes,Chicken Cacciatore Rice Bowl,"['Salt and ground black pepper to taste', '1/2 cup all-purpose flour', '1 1/2 pounds boneless, skinless chicken thighs, cut into 1-inch pieces', 'olive oil', '1 large red bell pepper, seeded and chopped', '1 small yellow onion, chopped', '2 cloves garlic, minced', '3/4 cup dry white wine', '3/4 cup chicken broth', '1 (24 ounce) jar RAGÚ® Old World Style® Traditional Sauce', '6 cups cooked brown rice']"
81,Lunch,Bowl Recipes,Greek Chicken Quinoa Bowl,"['3 (5.3 ounce) containers Greek yogurt', '1 tablespoon dried oregano', '1/2 lemon, juiced', '1/2 teaspoon ground black pepper', '1/2 teaspoon granulated garlic', '2 pounds chicken breasts', '2 cups chicken broth', '1 cup quinoa', '2 cloves garlic, minced', '3 small cucumbers, quartered and chopped', '2 roasted red peppers, drained and sliced', '1 pint grape tomatoes, halved', '1 1/4 cups Kalamata olives, sliced', '1 (15 ounce) can chickpeas, drained and rinsed', '1/2 cup diced red onion', '1 1/4 cups olive oil', '1/4 cup red wine vinegar', '1 (4 ounce) package crumbled feta cheese', '1 lemon, juiced', '1 teaspoon ground black pepper', '2 teaspoons dried oregano', '1/2 teaspoon dried dill weed', '1/4 teaspoon granulated garlic']"
82,Lunch,Bowl Recipes,Amazing Peanut Soba Noodles,"['2 (8 ounce) packages soba noodles', '1 1/2 tablespoons canola oil', '1 onion, diced', '3 cloves garlic, minced', '2 teaspoons grated fresh ginger root', '1 cup shredded carrots', '1 red bell pepper, diced', '4 scallions, diced, divided', '3 tablespoons soy sauce', '2 tablespoons creamy peanut butter', '1 tablespoon sesame oil', '2 teaspoons sriracha hot sauce', '2 teaspoons brown sugar, or to taste', '1 cucumber, sliced', '2 teaspoons rice vinegar', '1 tablespoon toasted sesame seeds', '1 lime, cut into wedges']"
83,Lunch,Bowl Recipes,Fajita Buddha Bowl,"['1 teaspoon coconut oil', '1 cup frozen bell peppers', '1 cup frozen corn', 'salt and ground black pepper to taste', '2 cups refried beans', '2 cups cooked brown rice', '1/4 cup guacamole']"
84,Lunch,Bowl Recipes,Sizzling Steak Burrito Bowl,"['1 1/2 pounds beef tenderloin tips, cut into bite-size pieces', '1 (6 ounce) pouch carne asada marinade with jalapeno and garlic (such as Frontera(R))', '1 tablespoon adobo sauce from chipotle peppers', '1/2 teaspoon Montreal steak seasoning', '3/4 cup ranch dressing', '1 chipotle pepper in adobo sauce, finely chopped', '1 teaspoon adobo sauce from chipotle peppers', '2 cups water', '1 (14.5 ounce) can diced tomatoes with green chile peppers, warmed', '1 (6.8 ounce) package Spanish-style rice mix (such as Rice-A-Roni(R))', '2 tablespoons margarine', '1 avocado, cut into wedges', '3 Roma tomatoes, chopped', '1 onion, diced', '1 cup shredded lettuce', '3/4 cup shredded Cheddar cheese', '1 lime, cut into wedges', '1 jalapeno pepper, diced', '1/4 cup chopped fresh cilantro', '1 cup pinto beans, drained', '1 cup Southwest-style corn with poblano and red peppers, drained', '2 teaspoons vegetable oil, or as needed']"
85,Lunch,Bowl Recipes,Bibimbap with Beef,"['1/2 pound beef top sirloin steak', '2 tablespoons soy sauce', '1 tablespoon sesame oil', '2 teaspoons honey', '2 teaspoons dry sherry', '4 cups hot cooked rice', '2 teaspoons vegetable oil', '1 carrot, thinly sliced', '1 1/2 cups bean sprouts', '1/2 cup peeled and matchstick-cut daikon radish', '1/4 teaspoon salt', 'ground black pepper to taste', '1/8 teaspoon cayenne pepper, or to taste', '1 cup fresh spinach']"
86,Lunch,Bowl Recipes,Elote Bowl with Grilled Pineapple,"['1 medium fresh pineapple, peeled and cut into 1/2 inch slices', '2 ears corn, husks and silks removed', '1 tablespoon vegetable oil, or more as needed', '2 cups cooked brown rice', '2 tablespoons crema Mexicana (Mexican cream)', '2 dashes hot sauce, or to taste', '2 tablespoons crumbled cotija cheese', '1 bunch fresh cilantro', 'salt and ground black pepper to taste', '1 lime, cut in wedges']"
87,Lunch,Bowl Recipes,"Grain Bowl with Blackened Shrimp, Avocado, and Black Beans","['1 1/8 cups water', ""1/2 cup dirty rice mix (such as Zatarain's(R) Dirty Brown Rice)"", '1 pound large shrimp, peeled and deveined', '1 tablespoon chili powder', '2 teaspoons paprika', '1 1/2 teaspoons cumin', '1 teaspoon onion powder', '1 teaspoon salt', '1/4 teaspoon ground black pepper', '2 tablespoons olive oil', '1 (15 ounce) can corn, drained', '1 red bell pepper, diced', '1/4 cup chopped fresh cilantro', '1 lime, juiced', '1 tablespoon olive oil', '1 avocado', '1/4 cup chopped fresh cilantro', '1/4 cup plain Greek yogurt (such as Chobani(R))', '1 clove garlic', '3 tablespoons olive oil', '1/2 teaspoon salt', '1/4 teaspoon ground black pepper', '1 (15 ounce) can black beans, drained', '1 avocado, sliced', '1 lime, cut into wedges']"
88,Lunch,Bowl Recipes,Prawns and Vegetables Over Pan-Fried Udon Noodles,"['1/2 cup soy sauce', '1/2 cup water', '1/3 cup brown sugar', '1/2 tablespoon ground ginger', '1 1/2 cups water, divided', '4 stalks celery, halved lengthwise and cut into 2-inch sticks', '1/2 red bell pepper, sliced into thin strips', '1/2 yellow bell pepper, sliced into thin strips', '10 prawns, peeled, or more to taste', '1 1/2 tablespoons lemon juice', '2 (7 ounce) packages fresh udon noodles']"
89,Lunch,Bowl Recipes,Chicken Fajita Bowl,"['cooking spray', '1 pound skinless, boneless chicken breast halves, diced', '1 pinch salt and ground black pepper to taste', '1/3 large sweet onion, sliced', '1/3 green bell pepper, sliced', '1/3 red bell pepper, sliced', '1/3 yellow bell pepper, sliced', '1 (10 ounce) can diced tomatoes and green chiles (such as RO*TEL(R))', '1 (10 ounce) package frozen cauliflower rice', '1 cup shredded mild Cheddar cheese', '1/2 avocado, diced', '2 tablespoons salsa', '2 tablespoons sour cream']"
90,Lunch,Bowl Recipes,Boost Bowl With Lemon Tahini Sauce,"['25 Brussels sprouts, halved', '3/4 pound red-skinned new potatoes, halved', '3/4 pound small purple potatoes, halved', '2 sweet potatoes, peeled and cut into 1-inch cubes', '1/2 head cauliflower, cut into small chunks', '1/2 lemon, juiced', '2 tablespoons extra-virgin olive oil, or more to taste', '1 tablespoon balsamic vinegar', '1 tablespoon Dijon mustard (optional)', '1 clove garlic, minced', 'salt and ground black pepper to taste', '1/4 cup tahini', '1/4 cup nutritional yeast', '3 tablespoons lemon juice', '1 tablespoon water, or more as needed']"
91,Lunch,Bowl Recipes,Buddha Bowl Power Menu,"['1 cup raw cashews', '6 dates, pitted', '1 tablespoon flaxseed meal', '1/8 teaspoon ground cinnamon', '1 pinch salt', '1 tablespoon coconut oil', '1 cup water', '1/2 cup brown rice', '1 pinch salt', '1/2 cup fresh fava beans, shelled', '1/4 red bell pepper, diced', '1/4 cup frozen peas', '1/4 cup diced Swiss cheese', '1/4 cup canned artichoke hearts, drained and chopped', '2 teaspoons Dijon mustard', '2 tablespoons olive oil', '1 teaspoon white wine vinegar', '1 hard-boiled egg', '1/2 cup plain yogurt', '1/4 avocado, diced', '2 tablespoons pomegranate seeds', '1 teaspoon chia seeds', '1/4 cup frozen blueberries', '2 tablespoons pomegranate seeds', '3 jasmine flower buds', '2 cups water']"
92,Lunch,Bowl Recipes,Ramen Bowl,"['8 cups water', '8 cloves garlic, peeled and whole', '8 slices fresh ginger root', '1/2 medium onion, halved and separated', '4 eggs', '1 pinch salt and freshly ground black pepper to taste (optional)', '1/2 cup soy sauce', '1/4 cup sake', '2 tablespoons Thai-style chile sauce', '2 teaspoons sesame oil', '2 tablespoons white sugar', '1 1/2 teaspoons salt', '15 ounces dried Japanese-style noodles', '12 large shrimp, shelled and deveined, at room temperature', '4 large dry sea scallops, halved, at room temperature', '1 1/2 cups fresh bean sprouts', '1/2 cup sliced scallions']"
93,Lunch,Bowl Recipes,Bibimbap ,"['3 tablespoons soy sauce', '3 tablespoons white sugar', '5 tablespoons sesame oil, divided, or to taste', '1 tablespoon garlic, minced', '1 teaspoon minced fresh ginger root', '1/2 pound beef brisket, thinly sliced, or to taste', '1 cup uncooked white rice', '1 1/2 cups water', '1 cup dried shiitake mushrooms', '1 small eggplant, cut into 1/4-inch slices', 'salt to taste', '1 small yellow squash, cut into 1/4-inch slices', '2 carrots, chopped', '1 cup broccoli florets', '1 cup bean sprouts', '2 eggs', '1 1/2 tablespoons rice vinegar', '4 leaves red leaf lettuce, cut widthwise into strips', '1 daikon radish, peeled and cut into matchsticks', '2 green onions, chopped (optional)']"
94,Lunch,Bowl Recipes,Do-It-Yourself Salmon Poke Bowls,"['4 cups cooked rice', '4 tablespoons soy sauce', '4 teaspoons rice vinegar', '4 teaspoons sesame oil', '1/4 teaspoon chile oil (optional)', '3/4 pound sashimi-grade salmon, cut into small cubes', '1 avocado, sliced, or to taste', '1 red bell pepper, sliced, or more to taste', '1/4 cup shelled edamame, or more to taste', '4 sheets dried seaweed, cut into strips, or to taste', '1 tablespoon pickled ginger, or to taste', '1 tablespoon furikake (Japanese nori seasoning), or to taste', '2 tablespoons chopped green onion, or to taste', '1 tablespoon sesame seeds, or to taste']"
95,Lunch,Bowl Recipes,Lemongrass Shrimp and Rice,"['1 (14 ounce) can coconut milk', '2 limes, zested and juiced', '3 4- to 6-inch lemon grass stalks, ends removed and coarsely chopped', '3 cloves garlic, coarsely chopped', '1 large shallot, coarsely chopped', '1 1/2 pounds uncooked medium shrimp, peeled and deveined', '2 cups uncooked brown rice', '1 1/2 cups water', '1 tablespoon olive oil', '1 (10 ounce) package shelled, cooked edamame', '1 (6 ounce) package snow peas']"
96,Lunch,Bowl Recipes,Make-Ahead Sausage and Veggie Bowls,"['nonstick cooking spray', '3 tablespoons olive oil, divided', '1 1/4 cups uncooked brown rice', '2 1/2 cups water', '1/2 teaspoon salt', '5 Italian turkey sausage links', '1 large red onion, cut into 1-inch pieces', '1 pound Brussels sprouts, trimmed and halved', '1 teaspoon garlic powder', '1/2 teaspoon salt', '1/2 teaspoon ground black pepper', '1 orange bell pepper, cut into 1-inch pieces', '5 (3-cup) storage containers', '1/4 cup grated Parmesan cheese, or to taste']"
97,Lunch,Bowl Recipes,Korean Bulgogi Bowl,"['1 pound lean ground beef', '1 tablespoon sesame oil', '1/4 cup brown sugar', '1/4 cup soy sauce', '1/4 cup water', '1/2 Asian pear, grated', '5 cloves garlic, minced, or more to taste', '1 inch piece ginger, peeled and diced', '1 teaspoon red pepper flakes', '1/2 teaspoon ground black pepper', '1 cup cooked brown rice, or more to taste', '1 head romaine lettuce, chopped, or to taste', '1 cucumber, diced', '1 red bell pepper, diced, or to taste (optional)', '1 tablespoon sesame seeds, or to taste (optional)']"
98,Lunch,Bowl Recipes,Cuban Bowl,"['2 sweet potatoes, cut into 1/2-inch cubes', '2 tablespoons coconut oil (such as British Class(R)), melted', '1 tablespoon salt, divided', '1 tablespoon ground cumin (such as British Class(R)), divided', '1 medium tomato, diced', '1 medium red onion, diced', '2 tablespoons chopped fresh cilantro', '1 tablespoon olive oil', '1 tablespoon lime juice', '2 cups cooked black beans', '2 cups cooked brown rice', '2 avocados, halved and sliced', '2 cups plantain chips (such as Cool Runnings(R))']"
99,Lunch,Bowl Recipes,Vegetarian Banh Mi Bowls,"['3 quarts water', '1/2 (14 ounce) package boil-in-bag brown rice', '1 quart water', '1/4 (12 ounce) package boil-in-bag quinoa', '1 cucumber, thinly sliced', '2 carrots, thinly sliced, or more to taste', '6 radishes, thinly sliced, or more to taste', '1/2 cup rice vinegar', '1/4 cup water', '1/4 cup white sugar', '1 tablespoon sesame oil', '1 teaspoon salt', '1/2 cup egg-free mayonnaise', '2 tablespoons sriracha sauce', '1/2 cup chopped peanuts', '1/2 cup chopped cilantro']"
100,Lunch,Bowl Recipes,California Winter Poke,"['1 tablespoon sesame oil', '1 1/2 pounds fresh ahi (yellowfin) tuna loin', '1 tablespoon sesame seeds', '2 avocados, cut into 1/2-inch cubes', '1/3 cup pomegranate seeds', '3 scallions, finely chopped', '1/4 cup ponzu sauce (citrus soy-based sauce)', '1 small bunch cilantro, finely chopped', '1 Thai chile pepper, finely chopped', '1 1/2 cups cooked brown rice']"
101,Lunch,Bowl Recipes,Egg and Edamame Brown Rice Bowl,"['2 cups cooked RiceSelect(R) Texmati(R) Brown Rice (freshly cooked and hot)', '4 scallions, thinly sliced', '1/2 cup edamame', '1 teaspoon red wine vinegar', 'Kosher salt and freshly ground black pepper', '3 tablespoons olive oil', '4 large eggs', '1 avocado, chopped', 'Sriracha hot sauce', 'Thai basil']"
102,Lunch,Bowl Recipes,Japanese Gyudon (Beef Bowl),"['4 cups Japanese sushi-style rice', '1 1/3 cups dashi soup', '5 tablespoons soy sauce', '3 tablespoons mirin', '2 tablespoons white sugar', '1 teaspoon sake', '1 onion, thinly sliced', '1 pound thinly sliced beef sirloin, cut into 2-inch pieces']"
